{"contractVersion":"1.0.0","provenance":{"contractVersion":"1.0.0","subject":{"type":"repository","id":"specops-unity-reference-implementation","revision":{"scheme":"git-commit-sha1","identifier":"46a16eb725294fa43943c8256dfb36d66b75d4e4"}},"executionId":"9e158983-f4b7-47ff-9816-dbc09bc943f2","producer":{"id":"specops-unity-reference-implementation/eval-producer","version":"git-commit-sha1:46a16eb725294fa43943c8256dfb36d66b75d4e4"},"executedDefinition":{"type":"eval-definition","id":"specops-derived-state-consistency","version":"1.0.0","reference":".specops/evals/specops-derived-state-consistency.eval.json"},"governingContracts":[{"id":"eval-result.schema.json","version":"1.0.0","reference":".specops/contracts/eval-result.schema.json"},{"id":"evidence-provenance.schema.json","version":"1.0.0","reference":".specops/contracts/evidence-provenance.schema.json"},{"id":"eval-definition.schema.json","version":"1.0.0","reference":".specops/contracts/eval-definition.schema.json"}],"targetScope":[{"type":"project-instance-derived-state","id":"specops-routing-and-feature-state","reference":"Assets/Project/Docs/Specifications"}],"executedAtUtc":"2026-09-05T17:14:53.1489190Z","limitations":[],"unresolvedUnknowns":[]},"definitionContentIdentity":{"algorithm":"specops-json-jcs-sha256-v1","value":"4702aae1c11777990afab0073fbe35f07e86611d0837b3748998f8801a9c5612"},"overallResult":"PASS","checkResults":[{"id":"authority-routes-resolve","executed":true,"result":"PASS","observations":["All configured authority, contract, permission, Skill, ADR, and eval routes resolve inside the subject."]},{"id":"feature-authority-triplets","executed":true,"result":"PASS","observations":["All 1 instantiated feature directories contain the exact authority triplet."]},{"id":"feature-state-schema-valid","executed":true,"result":"PASS","observations":["Validated 1 feature-state instances against the installed contract."]},{"id":"feature-id-directory-match","executed":true,"result":"PASS","observations":["Every featureId exactly equals its containing directory name."]},{"id":"acceptance-id-exact-match","executed":true,"result":"PASS","observations":["Acceptance headings and state AC ID sets match exactly using the approved case-sensitive parser."]},{"id":"state-reference-resolution","executed":true,"result":"PASS","observations":["All non-null scalar and adrReferences array-item paths resolve inside the immutable subject."]},{"id":"state-lifecycle-consistency","executed":true,"result":"PASS","observations":["Lifecycle conditionals hold for 1 feature-state instances; this does not prove evidence authenticity."]}]}
