{"contractVersion":"1.0.0","provenance":{"contractVersion":"1.0.0","subject":{"type":"repository","id":"specops-unity-reference-implementation","revision":{"scheme":"git-commit-sha1","identifier":"46a16eb725294fa43943c8256dfb36d66b75d4e4"}},"executionId":"fcc6cc0c-3dfb-474d-aa10-1c4a1f0ef9a0","producer":{"id":"specops-unity-reference-implementation/eval-producer","version":"git-commit-sha1:46a16eb725294fa43943c8256dfb36d66b75d4e4"},"executedDefinition":{"type":"eval-definition","id":"unity-clean-architecture-static","version":"1.0.0","reference":".specops/evals/unity-clean-architecture-static.eval.json"},"governingContracts":[{"id":"eval-result.schema.json","version":"1.0.0","reference":".specops/contracts/eval-result.schema.json"},{"id":"evidence-provenance.schema.json","version":"1.0.0","reference":".specops/contracts/evidence-provenance.schema.json"},{"id":"eval-definition.schema.json","version":"1.0.0","reference":".specops/contracts/eval-definition.schema.json"}],"targetScope":[{"type":"unity-project-runtime-architecture","id":"infinite-monkey-runtime-layers","reference":"Assets/Project/Code/Runtime"}],"executedAtUtc":"2026-09-05T17:14:41.7083092Z","limitations":[],"unresolvedUnknowns":[]},"definitionContentIdentity":{"algorithm":"specops-json-jcs-sha256-v1","value":"aa07fa7eb27c04755372b981fb330646d1f3b9378f422336c24080368d87d64f"},"overallResult":"PASS","checkResults":[{"id":"runtime-asmdef-set","executed":true,"result":"PASS","observations":["The immutable subject contains exactly the seven declared runtime asmdefs."]},{"id":"runtime-assembly-names","executed":true,"result":"PASS","observations":["Every runtime asmdef declares its exact authoritative assembly name."]},{"id":"engine-independence-flags","executed":true,"result":"PASS","observations":["Domain and Application explicitly set noEngineReferences=true."]},{"id":"runtime-project-reference-graph","executed":true,"result":"PASS","observations":["Every resolved project runtime reference is a subset of the authoritative Utility-expanded allowlist."]},{"id":"domain-application-source-boundary","executed":true,"result":"PASS","observations":["The dependency-free lexical scanner found no prohibited Unity namespace prefixes or MonoBehaviour base types in Domain/Application source."]},{"id":"generated-artifacts-untracked","executed":true,"result":"PASS","observations":["No prohibited generated artifact occurs in subject X tracked paths; ignored local presence is excluded."]}]}
