{"contractVersion":"1.0.0","provenance":{"contractVersion":"1.0.0","subject":{"type":"repository","id":"specops-unity-reference-implementation","revision":{"scheme":"git-commit-sha1","identifier":"46a16eb725294fa43943c8256dfb36d66b75d4e4"}},"executionId":"cf8f9346-19fb-4490-ad9c-fe721d89b51f","producer":{"id":"specops-unity-reference-implementation/eval-producer","version":"git-commit-sha1:46a16eb725294fa43943c8256dfb36d66b75d4e4"},"executedDefinition":{"type":"eval-definition","id":"unity-editmode-validation","version":"1.0.0","reference":".specops/evals/unity-editmode-validation.eval.json"},"governingContracts":[{"id":"eval-result.schema.json","version":"1.0.0","reference":".specops/contracts/eval-result.schema.json"},{"id":"evidence-provenance.schema.json","version":"1.0.0","reference":".specops/contracts/evidence-provenance.schema.json"},{"id":"eval-definition.schema.json","version":"1.0.0","reference":".specops/contracts/eval-definition.schema.json"}],"targetScope":[{"type":"unity-project-editmode-suite","id":"InfiniteMonkey.EditModeTests","reference":"Assets/Project/Code/Tests/EditMode/InfiniteMonkey.EditModeTests.asmdef"}],"executedAtUtc":"2026-09-05T17:34:21.5207780Z","limitations":["Compilation warnings are diagnostic only and are not deterministically normalized by the production adapter."],"unresolvedUnknowns":[]},"definitionContentIdentity":{"algorithm":"specops-json-jcs-sha256-v1","value":"e1b74181d6229313d9c379d51b095325bdfc924ceea6e98436fd0db3dd233033"},"overallResult":"PASS","checkResults":[{"id":"unity-version-match","executed":true,"result":"PASS","observations":["actual=6000.5.8f1 (5cb7df797b7d);expected=6000.5.8f1 (5cb7df797b7d);comparison=ordinal"]},{"id":"unity-compilation-success","executed":true,"result":"PASS","observations":["completed=true;errors=0;warnings-do-not-fail=true"]},{"id":"editmode-suite-executed","executed":true,"result":"PASS","observations":["executedAssembly=InfiniteMonkey.EditModeTests;expected=InfiniteMonkey.EditModeTests;completeAssemblySelection=true"]},{"id":"editmode-required-tests-discovered","executed":true,"result":"PASS","observations":["required=14;discovered=14;identity=ordinal-exact"]},{"id":"editmode-zero-failures","executed":true,"result":"PASS","observations":["failed=0;inconclusive=0;notExecuted=0"]},{"id":"unity-exit-success","executed":true,"result":"PASS","observations":["exitCode=0;expected=0"]},{"id":"unity-tracked-state-preserved","executed":true,"result":"PASS","observations":["changedEntries=0;comparison=exact-byte;pathIdentity=repository-relative-ordinal","generatedPaths=47954;generatedPathsExcluded=true","packagesLock=Preserved;specialRule=false"]}]}
