{"contractVersion":"1.0.0","provenance":{"contractVersion":"1.0.0","subject":{"type":"repository","id":"specops-unity-reference-implementation","revision":{"scheme":"git-commit-sha1","identifier":"46a16eb725294fa43943c8256dfb36d66b75d4e4"}},"executionId":"d3398986-3a2a-416f-b005-9878f36eddff","producer":{"id":"specops-unity-reference-implementation/eval-producer","version":"git-commit-sha1:46a16eb725294fa43943c8256dfb36d66b75d4e4"},"executedDefinition":{"type":"eval-definition","id":"specops-core-contract-integrity","version":"1.0.0","reference":".specops/evals/specops-core-contract-integrity.eval.json"},"governingContracts":[{"id":"eval-result.schema.json","version":"1.0.0","reference":".specops/contracts/eval-result.schema.json"},{"id":"evidence-provenance.schema.json","version":"1.0.0","reference":".specops/contracts/evidence-provenance.schema.json"},{"id":"eval-definition.schema.json","version":"1.0.0","reference":".specops/contracts/eval-definition.schema.json"}],"targetScope":[{"type":"framework-contract-set","id":"specops-core-contracts","reference":".specops/contracts"}],"executedAtUtc":"2026-09-05T17:16:15.0996591Z","limitations":[],"unresolvedUnknowns":[]},"definitionContentIdentity":{"algorithm":"specops-json-jcs-sha256-v1","value":"c9406453833d46e6813186cfbae5ba249a0c8e7c76af460b292073412cd23dd2"},"overallResult":"PASS","checkResults":[{"id":"contracts-json-parse","executed":true,"result":"PASS","observations":["Strict JSON parsed for 12 contract documents."]},{"id":"contracts-id-unique","executed":true,"result":"PASS","observations":["Every contract has one ordinal-unique nonempty root $id."]},{"id":"contracts-version-consistent","executed":true,"result":"PASS","observations":["Every contract version declaration equals its instance const."]},{"id":"contracts-draft-declared","executed":true,"result":"PASS","observations":["Every contract declares the exact approved Draft 2020-12 URI."]},{"id":"contracts-references-resolve","executed":true,"result":"PASS","observations":["All repository-local contract references and fragments resolve without network access."]},{"id":"contracts-schema-valid","executed":true,"result":"PASS","observations":["The approved schema adapter accepted 12 schema documents."]}]}
